{
  "$schema": "https://json-schema.org/draft/2020-12/schema",
  "title": "VIKC 2026 user-guide document",
  "type": "object",
  "required": [
    "docId",
    "slug",
    "title",
    "source",
    "sha256",
    "blocks"
  ],
  "properties": {
    "docId": {
      "type": "string"
    },
    "slug": {
      "type": "string"
    },
    "title": {
      "type": "string"
    },
    "source": {
      "type": "string",
      "description": "path of the original file in the repository"
    },
    "lang": {
      "enum": [
        "vi",
        "en"
      ]
    },
    "kind": {
      "enum": [
        "pdf-text",
        "pdf-scan",
        "xlsx",
        "image"
      ]
    },
    "tags": {
      "type": "array",
      "items": {
        "type": "string"
      }
    },
    "pageCount": {
      "type": "integer"
    },
    "sha256": {
      "type": "string",
      "description": "hash of the source file at conversion time"
    },
    "generatedOn": {
      "type": "string",
      "format": "date"
    },
    "warnings": {
      "type": "array",
      "items": {
        "type": "string"
      }
    },
    "notes": {
      "type": "array",
      "items": {
        "type": "string"
      }
    },
    "assets": {
      "type": "array",
      "items": {
        "type": "string"
      }
    },
    "outline": {
      "type": "array",
      "items": {
        "type": "object",
        "required": [
          "level",
          "text",
          "page"
        ],
        "properties": {
          "level": {
            "type": "integer",
            "minimum": 1,
            "maximum": 6
          },
          "text": {
            "type": "string"
          },
          "page": {
            "type": "integer",
            "minimum": 1
          }
        }
      }
    },
    "blocks": {
      "type": "array",
      "items": {
        "type": "object",
        "required": [
          "page",
          "type",
          "text",
          "markdown",
          "bbox"
        ],
        "properties": {
          "page": {
            "type": "integer",
            "minimum": 1
          },
          "type": {
            "enum": [
              "heading",
              "paragraph",
              "list",
              "table",
              "ocr-line",
              "image"
            ]
          },
          "text": {
            "type": "string"
          },
          "markdown": {
            "type": "string"
          },
          "bbox": {
            "type": "array",
            "items": {
              "type": "number"
            },
            "minItems": 4,
            "maxItems": 4,
            "description": "[x0, y0, x1, y1] in PDF points, or fractions for OCR blocks"
          },
          "level": {
            "type": "integer",
            "minimum": 1,
            "maximum": 6
          },
          "fontSize": {
            "type": "number"
          },
          "rows": {
            "type": "array",
            "items": {
              "type": "array",
              "items": {
                "type": [
                  "string",
                  "null"
                ]
              }
            }
          }
        }
      }
    }
  }
}
