{
  "docId": "01",
  "slug": "01-chuong-trinh-thi-dau",
  "title": "Chương trình giải / Championships programme",
  "source": "resources/user-guide/1_1ST VIKC 2026_Chương_trình_VIE.pdf",
  "lang": "vi",
  "kind": "pdf-text",
  "tags": [
    "programme",
    "schedule"
  ],
  "pageCount": 1,
  "sha256": "877e46ab9740f97389449c2e0c0073401da2ad9ffab6f3f724731adb5c59c161",
  "generatedOn": "2026-10-06",
  "warnings": [],
  "notes": [],
  "assets": [],
  "outline": [
    {
      "level": 3,
      "text": "GIẢI VÔ ĐỊCH KENDO QUỐC TẾ VIỆT NAM 2026",
      "page": 1
    },
    {
      "level": 3,
      "text": "CHƯƠNG TRÌNH",
      "page": 1
    }
  ],
  "blocks": [
    {
      "page": 1,
      "type": "heading",
      "text": "GIẢI VÔ ĐỊCH KENDO QUỐC TẾ VIỆT NAM 2026",
      "markdown": "### GIẢI VÔ ĐỊCH KENDO QUỐC TẾ VIỆT NAM 2026",
      "bbox": [
        158.66,
        96.59,
        463.3,
        110.94
      ],
      "level": 3,
      "fontSize": 12.96
    },
    {
      "page": 1,
      "type": "paragraph",
      "text": "1st Vietnam International Kendo Championships 2026",
      "markdown": "1st Vietnam International Kendo Championships 2026",
      "bbox": [
        181.37,
        111.38,
        440.5,
        123.6
      ],
      "fontSize": 11.04
    },
    {
      "page": 1,
      "type": "paragraph",
      "text": "Thời gian: 19 - 22 Tháng 11, 2026\nĐịa điểm: Trung tâm Hội nghị Quốc tế Vesak, Tam Chúc, Ninh Bình\nĐơn vị tổ chức: Liên đoàn Kendo Việt Nam (VKF)\nThi đẳng và cấp đẳng: Liên đoàn Kendo Việt Nam (VKF)",
      "markdown": "Thời gian: 19 - 22 Tháng 11, 2026\nĐịa điểm: Trung tâm Hội nghị Quốc tế Vesak, Tam Chúc, Ninh Bình\nĐơn vị tổ chức: Liên đoàn Kendo Việt Nam (VKF)\nThi đẳng và cấp đẳng: Liên đoàn Kendo Việt Nam (VKF)",
      "bbox": [
        72.02,
        138.93,
        368.11,
        186.86
      ],
      "fontSize": 10.56
    },
    {
      "page": 1,
      "type": "heading",
      "text": "CHƯƠNG TRÌNH",
      "markdown": "### CHƯƠNG TRÌNH",
      "bbox": [
        252.89,
        203.39,
        368.95,
        218.93
      ],
      "level": 3,
      "fontSize": 14.04
    },
    {
      "page": 1,
      "type": "table",
      "text": "Thứ 5 | 19/11 | Kendo Seminar\n15:00 – 17:00 | Seminar hướng dẫn bởi Hamasaki Mitsuru Sensei, 8-dan Hanshi\n17:00 – 18:00 | Godo Keiko\nThứ 6 | 20/11 | Kỳ thi Kyu/Dan – Họp Shinpan\n7:00 – 7:45 | Check-in\n8:00 – 11:00 | Kỳ thi Kyu/Dan\n11:00 – 12:00 | Seminar về Công tác trọng tài do thầy Hamasaki Mitsuru, 8-dan Hanshi hướng dẫn\n12:00 – 13:00 | Nghỉ, ăn trưa\n13:00 – 17:00 | Kỳ thi Dan\n16:00 – 17:00 | Buổi họp với đại diện các CLB\n16:00 – 17:00 | Buổi họp Shinpan chủ trì bởi Hamasaki Mitsuru Sensei, 8-dan Hanshi\n17:00 – 18:00 | Godo Keiko (Chỉ dành cho các Shinpan)\n19:30 – 22:00 | Tiệc chào đón (Chỉ dành cho các Shinpan)\n | Thi đấu Đồng đội Nữ 3 người\nThứ 7 | 21/11 | \n | Thi đấu Đồng đội Nam 3 người – Tiệc chào đón\n | \n7:00 – 8:00 | Công tác chuẩn bị - Kiểm tra Shinai\n8:00 – 8:45 | Lễ Khai mạc Ngày thứ 1\n9:00 – 12:00 | Thi đấu Đồng đội Nữ | Thi đấu Đồng đội Nam\n12:00 – 12:45 | Nghỉ, ăn trưa\n* Đồ ăn trưa được chuẩn bị sẵn từ 11:00. VĐV chưa đến lượt thi đấu có thể ăn trước.\n13:00 – 16:00 | Thi đấu Đồng đội Nữ | Thi đấu Đồng đội Nam (tiếp)\n16:15 – 17:00 | Lễ trao giải\n17:00 – 18:00 | Godo Keiko\n19:30 – 22:00 | Tiệc chào đón\n | Thi đấu Đồng đội Nữ 5 người\nChủ nhật | 22/11 | \n | Thi đấu Đồng đội Nam 5 người\n | \n7:00 – 8:00 | Công tác chuẩn bị - Kiểm tra Shinai (bổ sung)\n8:00 – 8:15 | Lễ Khai mạc Ngày thứ 2\n8:30 – 12:00 | Thi đấu Đồng đội Nữ | Thi đấu Đồng đội Nam\n12:00 – 12:45 | Nghỉ, ăn trưa\n* Đồ ăn trưa được chuẩn bị sẵn từ 11:00. VĐV chưa đến lượt thi đấu có thể ăn trước.\n13:00 – 17:00 | Thi đấu Đồng đội Nữ | Thi đấu Đồng đội Nam (tiếp)\n17:00 – 17:30 | Lễ Trao giải và Lễ Bế mạc\n17:30 – 18:30 | Godo Keiko",
      "markdown": "| Thứ 5 \\| 19/11 | Kendo Seminar |\n|---|---|\n| 15:00 – 17:00 | Seminar hướng dẫn bởi Hamasaki Mitsuru Sensei, 8-dan Hanshi |\n| 17:00 – 18:00 | Godo Keiko |\n| Thứ 6 \\| 20/11 | Kỳ thi Kyu/Dan – Họp Shinpan |\n| 7:00 – 7:45 | Check-in |\n| 8:00 – 11:00 | Kỳ thi Kyu/Dan |\n| 11:00 – 12:00 | Seminar về Công tác trọng tài do thầy Hamasaki Mitsuru, 8-dan Hanshi hướng dẫn |\n| 12:00 – 13:00 | Nghỉ, ăn trưa |\n| 13:00 – 17:00 | Kỳ thi Dan |\n| 16:00 – 17:00 | Buổi họp với đại diện các CLB |\n| 16:00 – 17:00 | Buổi họp Shinpan chủ trì bởi Hamasaki Mitsuru Sensei, 8-dan Hanshi |\n| 17:00 – 18:00 | Godo Keiko (Chỉ dành cho các Shinpan) |\n| 19:30 – 22:00 | Tiệc chào đón (Chỉ dành cho các Shinpan) |\n|  | Thi đấu Đồng đội Nữ 3 người |\n| Thứ 7 \\| 21/11 |  |\n|  | Thi đấu Đồng đội Nam 3 người – Tiệc chào đón |\n|  |  |\n| 7:00 – 8:00 | Công tác chuẩn bị - Kiểm tra Shinai |\n| 8:00 – 8:45 | Lễ Khai mạc Ngày thứ 1 |\n| 9:00 – 12:00 | Thi đấu Đồng đội Nữ \\| Thi đấu Đồng đội Nam |\n| 12:00 – 12:45 | Nghỉ, ăn trưa<br>* Đồ ăn trưa được chuẩn bị sẵn từ 11:00. VĐV chưa đến lượt thi đấu có thể ăn trước. |\n| 13:00 – 16:00 | Thi đấu Đồng đội Nữ \\| Thi đấu Đồng đội Nam (tiếp) |\n| 16:15 – 17:00 | Lễ trao giải |\n| 17:00 – 18:00 | Godo Keiko |\n| 19:30 – 22:00 | Tiệc chào đón |\n|  | Thi đấu Đồng đội Nữ 5 người |\n| Chủ nhật \\| 22/11 |  |\n|  | Thi đấu Đồng đội Nam 5 người |\n|  |  |\n| 7:00 – 8:00 | Công tác chuẩn bị - Kiểm tra Shinai (bổ sung) |\n| 8:00 – 8:15 | Lễ Khai mạc Ngày thứ 2 |\n| 8:30 – 12:00 | Thi đấu Đồng đội Nữ \\| Thi đấu Đồng đội Nam |\n| 12:00 – 12:45 | Nghỉ, ăn trưa<br>* Đồ ăn trưa được chuẩn bị sẵn từ 11:00. VĐV chưa đến lượt thi đấu có thể ăn trước. |\n| 13:00 – 17:00 | Thi đấu Đồng đội Nữ \\| Thi đấu Đồng đội Nam (tiếp) |\n| 17:00 – 17:30 | Lễ Trao giải và Lễ Bế mạc |\n| 17:30 – 18:30 | Godo Keiko |",
      "bbox": [
        72.48,
        234.8,
        546.87,
        741.32
      ],
      "rows": [
        [
          "Thứ 5 | 19/11",
          "Kendo Seminar"
        ],
        [
          "15:00 – 17:00",
          "Seminar hướng dẫn bởi Hamasaki Mitsuru Sensei, 8-dan Hanshi"
        ],
        [
          "17:00 – 18:00",
          "Godo Keiko"
        ],
        [
          "Thứ 6 | 20/11",
          "Kỳ thi Kyu/Dan – Họp Shinpan"
        ],
        [
          "7:00 – 7:45",
          "Check-in"
        ],
        [
          "8:00 – 11:00",
          "Kỳ thi Kyu/Dan"
        ],
        [
          "11:00 – 12:00",
          "Seminar về Công tác trọng tài do thầy Hamasaki Mitsuru, 8-dan Hanshi hướng dẫn"
        ],
        [
          "12:00 – 13:00",
          "Nghỉ, ăn trưa"
        ],
        [
          "13:00 – 17:00",
          "Kỳ thi Dan"
        ],
        [
          "16:00 – 17:00",
          "Buổi họp với đại diện các CLB"
        ],
        [
          "16:00 – 17:00",
          "Buổi họp Shinpan chủ trì bởi Hamasaki Mitsuru Sensei, 8-dan Hanshi"
        ],
        [
          "17:00 – 18:00",
          "Godo Keiko (Chỉ dành cho các Shinpan)"
        ],
        [
          "19:30 – 22:00",
          "Tiệc chào đón (Chỉ dành cho các Shinpan)"
        ],
        [
          "",
          "Thi đấu Đồng đội Nữ 3 người"
        ],
        [
          "Thứ 7 | 21/11",
          null
        ],
        [
          null,
          "Thi đấu Đồng đội Nam 3 người – Tiệc chào đón"
        ],
        [
          "",
          null
        ],
        [
          "7:00 – 8:00",
          "Công tác chuẩn bị - Kiểm tra Shinai"
        ],
        [
          "8:00 – 8:45",
          "Lễ Khai mạc Ngày thứ 1"
        ],
        [
          "9:00 – 12:00",
          "Thi đấu Đồng đội Nữ | Thi đấu Đồng đội Nam"
        ],
        [
          "12:00 – 12:45",
          "Nghỉ, ăn trưa\n* Đồ ăn trưa được chuẩn bị sẵn từ 11:00. VĐV chưa đến lượt thi đấu có thể ăn trước."
        ],
        [
          "13:00 – 16:00",
          "Thi đấu Đồng đội Nữ | Thi đấu Đồng đội Nam (tiếp)"
        ],
        [
          "16:15 – 17:00",
          "Lễ trao giải"
        ],
        [
          "17:00 – 18:00",
          "Godo Keiko"
        ],
        [
          "19:30 – 22:00",
          "Tiệc chào đón"
        ],
        [
          "",
          "Thi đấu Đồng đội Nữ 5 người"
        ],
        [
          "Chủ nhật | 22/11",
          null
        ],
        [
          null,
          "Thi đấu Đồng đội Nam 5 người"
        ],
        [
          "",
          null
        ],
        [
          "7:00 – 8:00",
          "Công tác chuẩn bị - Kiểm tra Shinai (bổ sung)"
        ],
        [
          "8:00 – 8:15",
          "Lễ Khai mạc Ngày thứ 2"
        ],
        [
          "8:30 – 12:00",
          "Thi đấu Đồng đội Nữ | Thi đấu Đồng đội Nam"
        ],
        [
          "12:00 – 12:45",
          "Nghỉ, ăn trưa\n* Đồ ăn trưa được chuẩn bị sẵn từ 11:00. VĐV chưa đến lượt thi đấu có thể ăn trước."
        ],
        [
          "13:00 – 17:00",
          "Thi đấu Đồng đội Nữ | Thi đấu Đồng đội Nam (tiếp)"
        ],
        [
          "17:00 – 17:30",
          "Lễ Trao giải và Lễ Bế mạc"
        ],
        [
          "17:30 – 18:30",
          "Godo Keiko"
        ]
      ]
    }
  ]
}
